{
  "$schema": "https://json-schema.org/draft/2020-12/schema",
  "$id": "urn:ios-experts:schema:project-registry:1.0.0",
  "type": "object",
  "required": [
    "schema_version",
    "developer_id",
    "host_id",
    "projects"
  ],
  "properties": {
    "$schema": {"type": "string"},
    "schema_version": {"const": "1.0.0"},
    "developer_id": {
      "type": "string",
      "minLength": 1,
      "pattern": "^[A-Za-z0-9][A-Za-z0-9._-]*$"
    },
    "host_id": {
      "type": "string",
      "minLength": 1,
      "pattern": "^[A-Za-z0-9][A-Za-z0-9._-]*$"
    },
    "projects": {
      "type": "array",
      "minItems": 1,
      "items": {
        "type": "object",
        "required": ["project_id", "remote_fingerprint", "checkouts"],
        "properties": {
          "project_id": {
            "type": "string",
            "minLength": 1,
            "pattern": "^[A-Za-z0-9][A-Za-z0-9._-]*$"
          },
          "remote_fingerprint": {
            "type": "string",
            "pattern": "^sha256:[0-9a-f]{64}$"
          },
          "checkouts": {
            "type": "array",
            "minItems": 1,
            "items": {
              "type": "object",
              "required": ["checkout_id", "path", "kind", "xcode_containers"],
              "properties": {
                "checkout_id": {
                  "type": "string",
                  "minLength": 1,
                  "pattern": "^[A-Za-z0-9][A-Za-z0-9._-]*$"
                },
                "path": {
                  "type": "string",
                  "minLength": 2,
                  "pattern": "^(?![\\s\\S]*(?:^|/)\\.\\.(?:/|$))/[^\\u0000-\\u001f\\u007f]*$"
                },
                "kind": {"enum": ["primary", "worktree"]},
                "xcode_containers": {
                  "type": "array",
                  "uniqueItems": true,
                  "items": {
                    "type": "string",
                    "minLength": 1,
                    "pattern": "^(?!/)(?![\\s\\S]*(?:^|/)\\.\\.(?:/|$))[^\\u0000-\\u001f\\u007f]+\\.(?:xcodeproj|xcworkspace)$"
                  }
                }
              },
              "additionalProperties": false
            }
          }
        },
        "additionalProperties": false
      }
    }
  },
  "additionalProperties": false
}
